[
  {
    "id": "gbahomebrew",
    "title": "GBA Homebrew & Unlicensed",
    "console": "gba",
    "kind": "bundle"
  },
  {
    "id": "nes-homebrew-collection",
    "title": "NES Homebrew Collection",
    "console": "nes",
    "kind": "bundle"
  },
  {
    "id": "gameboy-homebrew",
    "title": "Game Boy Homebrew",
    "console": "gb",
    "kind": "bundle"
  }
]
